{
  "title": "双打站位",
  "summary": "系统掌握双打站位与轮转配合。从基本站位原则到攻防转换中的位置调整，结合发接发和接杀训练，提升你和搭档的双打默契。",
  "difficulty": "advanced",
  "steps": [
    {
      "title": "双打站位基本原则",
      "note": "双打站位的核心是「进攻前后站，防守左右站」。理解这个原则后，你在场上就不会出现两个人抢球或大片空档无人覆盖的情况。",
      "content_slugs": ["basic-positioning"]
    },
    {
      "title": "发球与接发球站位",
      "note": "双打的发球和接发球是每个回合的起始博弈。反手发小球是双打的主流发球方式，发球质量直接决定了你能否在回合一开始就占据有利站位。",
      "content_slugs": ["backhand-short-serve"]
    },
    {
      "title": "轮转配合详解",
      "note": "轮转是双打最核心也最难掌握的技术。什么时候前后换左右、什么时候左右换前后，需要两个人高度默契。看完视频后建议和固定搭档一起反复练习。",
      "content_slugs": ["rotation-fundamentals"]
    },
    {
      "title": "网前控制能力",
      "note": "双打中前场选手的网前质量直接决定进攻机会。勾对角可以打乱对手站位，搓球能制造对手起球机会。这两项是前场选手的核心武器。",
      "content_slugs": ["cross-court-hook", "net-spin"]
    },
    {
      "title": "后场进攻衔接",
      "note": "后场选手需要杀球和吊球的能力来创造得分机会。注意双打杀球不追求一拍打死，重点是通过连续下压迫使对手起高球或回球质量下降。",
      "content_slugs": ["forehand-smash", "forehand-drop"]
    },
    {
      "title": "双打防守：接杀挡网",
      "note": "被对方进攻时，接杀挡网是最常用的防守手段。好的挡网能让球贴网而过，迫使对手起球，从而实现攻防转换。这是从防守转进攻的关键技术。",
      "content_slugs": ["doubles-smash-return"]
    },
    {
      "title": "全场步法与体能储备",
      "note": "双打节奏快、回合密集，对体能和脚步移动要求极高。全场步法的流畅度和专项体能是能否在比赛后半段保持站位质量的基础。",
      "content_slugs": ["full-court-footwork", "agility-training"]
    }
  ]
}
