{
  "title": "新手30天入门计划",
  "summary": "从零开始，30天内掌握羽毛球核心基本功。涵盖握拍、发球、高远球、步法和基础体能，帮你建立正确的动作框架，避免养成难以纠正的坏习惯。",
  "difficulty": "beginner",
  "steps": [
    {
      "day": 1,
      "title": "握拍基础",
      "note": "一切从握拍开始。正反手握拍是所有技术动作的起点——握拍方式决定了你未来击球质量的上限。先学正确姿势，再看常见错误，对照自查。",
      "content_slugs": ["forehand-backhand-grip", "common-grip-mistakes"]
    },
    {
      "day": 5,
      "title": "正手发高远球",
      "note": "发球是每一个回合的开始。正手发高远球是单打最常用的发球方式，学好它能让你在比赛中从容开局，掌握主动权。",
      "content_slugs": ["forehand-high-serve"]
    },
    {
      "day": 8,
      "title": "反手发小球",
      "note": "反手发小球在双打中几乎是必备技能，单打也常使用。与高远球发球形成互补，让对手无法提前预判你的发球意图。",
      "content_slugs": ["backhand-short-serve"]
    },
    {
      "day": 11,
      "title": "正手高远球",
      "note": "高远球是羽毛球最基础也最重要的击球动作，它包含了完整的引拍、挥拍和收拍过程。练好高远球，后面的杀球和吊球都是在这个动作基础上变化。",
      "content_slugs": ["forehand-clear"]
    },
    {
      "day": 15,
      "title": "基础步法入门",
      "note": "再好的手上技术，没有步法配合也打不出来。米字步法是羽毛球步法的核心框架，覆盖全场六个方向的移动。先从分解步法练起，不要急于求快。",
      "content_slugs": ["cross-step-drill"]
    },
    {
      "day": 19,
      "title": "全场步法串联",
      "note": "在米字步法基础上，练习全场步法的连贯衔接。重点是每次击球后的回中意识——打完球要迅速回到场地中心位置，准备下一拍。",
      "content_slugs": ["full-court-footwork"]
    },
    {
      "day": 23,
      "title": "体能基础：敏捷性训练",
      "note": "羽毛球对脚步灵活性要求极高。专项敏捷训练能提升你的启动速度和变向能力，这比单纯跑步对羽毛球的帮助大得多。",
      "content_slugs": ["agility-training"]
    },
    {
      "day": 26,
      "title": "力量训练入门",
      "note": "合理的力量训练能提升击球力量、减少伤病。这套训练针对羽毛球常用肌群设计，不需要去健身房，在家就能完成。",
      "content_slugs": ["badminton-strength"]
    },
    {
      "day": 30,
      "title": "反手高远球",
      "note": "反手高远球是新手阶段最后一个挑战。很多人打了很久反手还是软绵绵的，关键在于发力方式完全不同于正手。放在最后学，是因为需要前面积累的握拍转换和身体协调能力。",
      "content_slugs": ["backhand-clear"]
    }
  ]
}
