{
  "title": "杀球精通",
  "summary": "从正手杀球到跳杀，系统提升你的进攻能力。不只是学杀球动作本身，还包括杀球前的过渡球、杀球后的网前衔接，以及支撑进攻的体能基础。",
  "difficulty": "intermediate",
  "steps": [
    {
      "title": "进攻的起点：正手高远球",
      "note": "杀球和高远球共享同一个挥拍框架，只是击球点和拍面角度不同。如果你的高远球动作还不够顺畅，先回来巩固这个基础再练杀球，否则容易受伤。",
      "content_slugs": ["forehand-clear"]
    },
    {
      "title": "正手杀球核心动作",
      "note": "杀球的关键不是用蛮力，而是鞭打发力的时机。重点关注引拍时身体的侧转蓄力、击球瞬间的手腕内旋和收拍动作。",
      "content_slugs": ["forehand-smash"]
    },
    {
      "title": "杀球的力量支撑",
      "note": "杀球对核心力量和肩部稳定性要求很高。不做专项力量训练直接猛练杀球，肩伤几乎是必然的。这套训练着重加强杀球需要的肌群。",
      "content_slugs": ["badminton-strength"]
    },
    {
      "title": "吊球：杀球的最佳搭档",
      "note": "光会杀球还不够，对手很快就会适应你的节奏。吊球和杀球动作前期完全一样，能有效迷惑对手。杀吊结合才是真正有威胁的进攻。",
      "content_slugs": ["forehand-drop"]
    },
    {
      "title": "杀球后的网前衔接",
      "note": "杀球不是终结，而是进攻的开始。杀完球后对手回球往往到网前，你需要快速跟进用搓球或推球得分。这一步串联了进攻到网前的完整套路。",
      "content_slugs": ["net-spin", "net-push"]
    },
    {
      "title": "跳杀进阶",
      "note": "跳杀在正手杀球基础上增加了起跳环节，能获得更高的击球点和更大的下压角度。对身体协调性和体能要求更高，需要前面几步的充分积累。",
      "content_slugs": ["jump-smash"]
    },
    {
      "title": "进攻的脚步基础",
      "note": "好的进攻需要快速到位。敏捷性训练帮你提升启动速度，确保你能在最佳位置完成杀球，而不是被动地在不舒服的位置勉强出手。",
      "content_slugs": ["agility-training"]
    },
    {
      "title": "防守你的进攻：学会接杀",
      "note": "最好的进攻者也需要会防守。了解对手如何接你的杀球，能帮你找到杀球落点的最佳选择，知己知彼。",
      "content_slugs": ["smash-defense"]
    }
  ]
}
